{
  "schemaVersion": 1,
  "name": "Measured room",
  "width": 4.2,
  "depth": 3.5,
  "height": 2.4,
  "floorElevation": 0,
  "wallThickness": 0.2,
  "openings": [
    { "wall": "south", "kind": "door", "offset": 1, "width": 0.9, "sill": 0, "height": 2.1 }
  ],
  "unseen": [],
  "assumptions": ["The photograph looks about 4.2 m wide."]
}
